{
  "siteId": "torrance-highland-pond-viewing-area",
  "algorithmVersion": "site-score-1.1.0",
  "generatedAt": "2026-09-22T09:22:04.776176Z",
  "months": [
    {
      "siteId": "torrance-highland-pond-viewing-area",
      "month": 1,
      "skyQuality": 53,
      "tripComfort": 53,
      "stargazingTrip": 53,
      "clearSkyScore": 28,
      "darknessScore": 84,
      "dewScore": 44,
      "elevationScore": 50,
      "temperatureComfortScore": 24,
      "windComfortScore": 96,
      "rainComfortScore": 37,
      "accessScore": 72,
      "confidenceScore": 100,
      "confidenceLevel": "high",
      "reasons": [
        "Clear-sky climatology score: 28",
        "Calibrated darkness score: 84"
      ],
      "caveats": [
        "Temperature comfort uses the monthly astronomical-night mean, not hourly utility"
      ]
    },
    {
      "siteId": "torrance-highland-pond-viewing-area",
      "month": 2,
      "skyQuality": 63,
      "tripComfort": 56,
      "stargazingTrip": 62,
      "clearSkyScore": 47,
      "darknessScore": 84,
      "dewScore": 56,
      "elevationScore": 50,
      "temperatureComfortScore": 28,
      "windComfortScore": 96,
      "rainComfortScore": 52,
      "accessScore": 72,
      "confidenceScore": 100,
      "confidenceLevel": "high",
      "reasons": [
        "Clear-sky climatology score: 47",
        "Calibrated darkness score: 84"
      ],
      "caveats": [
        "Temperature comfort uses the monthly astronomical-night mean, not hourly utility"
      ]
    },
    {
      "siteId": "torrance-highland-pond-viewing-area",
      "month": 3,
      "skyQuality": 69,
      "tripComfort": 65,
      "stargazingTrip": 68,
      "clearSkyScore": 58,
      "darknessScore": 84,
      "dewScore": 62,
      "elevationScore": 50,
      "temperatureComfortScore": 45,
      "windComfortScore": 97,
      "rainComfortScore": 57,
      "accessScore": 72,
      "confidenceScore": 100,
      "confidenceLevel": "high",
      "reasons": [
        "Clear-sky climatology score: 58",
        "Calibrated darkness score: 84"
      ],
      "caveats": [
        "Temperature comfort uses the monthly astronomical-night mean, not hourly utility"
      ]
    },
    {
      "siteId": "torrance-highland-pond-viewing-area",
      "month": 4,
      "skyQuality": 68,
      "tripComfort": 76,
      "stargazingTrip": 70,
      "clearSkyScore": 57,
      "darknessScore": 84,
      "dewScore": 61,
      "elevationScore": 50,
      "temperatureComfortScore": 72,
      "windComfortScore": 97,
      "rainComfortScore": 53,
      "accessScore": 72,
      "confidenceScore": 100,
      "confidenceLevel": "high",
      "reasons": [
        "Clear-sky climatology score: 57",
        "Calibrated darkness score: 84"
      ],
      "caveats": [
        "Temperature comfort uses the monthly astronomical-night mean, not hourly utility"
      ]
    },
    {
      "siteId": "torrance-highland-pond-viewing-area",
      "month": 5,
      "skyQuality": 67,
      "tripComfort": 90,
      "stargazingTrip": 72,
      "clearSkyScore": 58,
      "darknessScore": 84,
      "dewScore": 51,
      "elevationScore": 50,
      "temperatureComfortScore": 97,
      "windComfortScore": 98,
      "rainComfortScore": 64,
      "accessScore": 72,
      "confidenceScore": 100,
      "confidenceLevel": "high",
      "reasons": [
        "Clear-sky climatology score: 58",
        "Calibrated darkness score: 84"
      ],
      "caveats": [
        "Temperature comfort uses the monthly astronomical-night mean, not hourly utility"
      ]
    },
    {
      "siteId": "torrance-highland-pond-viewing-area",
      "month": 6,
      "skyQuality": 64,
      "tripComfort": 92,
      "stargazingTrip": 69,
      "clearSkyScore": 54,
      "darknessScore": 84,
      "dewScore": 33,
      "elevationScore": 50,
      "temperatureComfortScore": 100,
      "windComfortScore": 99,
      "rainComfortScore": 66,
      "accessScore": 72,
      "confidenceScore": 100,
      "confidenceLevel": "high",
      "reasons": [
        "Clear-sky climatology score: 54",
        "Calibrated darkness score: 84"
      ],
      "caveats": [
        "Temperature comfort uses the monthly astronomical-night mean, not hourly utility"
      ]
    },
    {
      "siteId": "torrance-highland-pond-viewing-area",
      "month": 7,
      "skyQuality": 65,
      "tripComfort": 92,
      "stargazingTrip": 71,
      "clearSkyScore": 59,
      "darknessScore": 84,
      "dewScore": 25,
      "elevationScore": 50,
      "temperatureComfortScore": 100,
      "windComfortScore": 99,
      "rainComfortScore": 65,
      "accessScore": 72,
      "confidenceScore": 100,
      "confidenceLevel": "high",
      "reasons": [
        "Clear-sky climatology score: 59",
        "Calibrated darkness score: 84"
      ],
      "caveats": [
        "Temperature comfort uses the monthly astronomical-night mean, not hourly utility"
      ]
    },
    {
      "siteId": "torrance-highland-pond-viewing-area",
      "month": 8,
      "skyQuality": 70,
      "tripComfort": 92,
      "stargazingTrip": 74,
      "clearSkyScore": 71,
      "darknessScore": 84,
      "dewScore": 19,
      "elevationScore": 50,
      "temperatureComfortScore": 100,
      "windComfortScore": 99,
      "rainComfortScore": 66,
      "accessScore": 72,
      "confidenceScore": 100,
      "confidenceLevel": "high",
      "reasons": [
        "Clear-sky climatology score: 71",
        "Calibrated darkness score: 84"
      ],
      "caveats": [
        "Temperature comfort uses the monthly astronomical-night mean, not hourly utility"
      ]
    },
    {
      "siteId": "torrance-highland-pond-viewing-area",
      "month": 9,
      "skyQuality": 69,
      "tripComfort": 90,
      "stargazingTrip": 73,
      "clearSkyScore": 68,
      "darknessScore": 84,
      "dewScore": 21,
      "elevationScore": 50,
      "temperatureComfortScore": 100,
      "windComfortScore": 98,
      "rainComfortScore": 58,
      "accessScore": 72,
      "confidenceScore": 100,
      "confidenceLevel": "high",
      "reasons": [
        "Clear-sky climatology score: 68",
        "Calibrated darkness score: 84"
      ],
      "caveats": [
        "Temperature comfort uses the monthly astronomical-night mean, not hourly utility"
      ]
    },
    {
      "siteId": "torrance-highland-pond-viewing-area",
      "month": 10,
      "skyQuality": 61,
      "tripComfort": 84,
      "stargazingTrip": 65,
      "clearSkyScore": 47,
      "darknessScore": 84,
      "dewScore": 32,
      "elevationScore": 50,
      "temperatureComfortScore": 91,
      "windComfortScore": 96,
      "rainComfortScore": 45,
      "accessScore": 72,
      "confidenceScore": 100,
      "confidenceLevel": "high",
      "reasons": [
        "Clear-sky climatology score: 47",
        "Calibrated darkness score: 84"
      ],
      "caveats": [
        "Temperature comfort uses the monthly astronomical-night mean, not hourly utility"
      ]
    },
    {
      "siteId": "torrance-highland-pond-viewing-area",
      "month": 11,
      "skyQuality": 52,
      "tripComfort": 71,
      "stargazingTrip": 56,
      "clearSkyScore": 28,
      "darknessScore": 84,
      "dewScore": 30,
      "elevationScore": 50,
      "temperatureComfortScore": 66,
      "windComfortScore": 95,
      "rainComfortScore": 38,
      "accessScore": 72,
      "confidenceScore": 100,
      "confidenceLevel": "high",
      "reasons": [
        "Clear-sky climatology score: 28",
        "Calibrated darkness score: 84"
      ],
      "caveats": [
        "Temperature comfort uses the monthly astronomical-night mean, not hourly utility"
      ]
    },
    {
      "siteId": "torrance-highland-pond-viewing-area",
      "month": 12,
      "skyQuality": 47,
      "tripComfort": 60,
      "stargazingTrip": 50,
      "clearSkyScore": 19,
      "darknessScore": 84,
      "dewScore": 26,
      "elevationScore": 50,
      "temperatureComfortScore": 41,
      "windComfortScore": 96,
      "rainComfortScore": 34,
      "accessScore": 72,
      "confidenceScore": 100,
      "confidenceLevel": "high",
      "reasons": [
        "Clear-sky climatology score: 19",
        "Calibrated darkness score: 84"
      ],
      "caveats": [
        "Temperature comfort uses the monthly astronomical-night mean, not hourly utility"
      ]
    }
  ]
}
