{
  "siteId": "akasaki-promenade",
  "algorithmVersion": "site-score-1.1.0",
  "generatedAt": "2026-09-08T13:48:19.114028Z",
  "months": [
    {
      "siteId": "akasaki-promenade",
      "month": 1,
      "skyQuality": 81,
      "tripComfort": 66,
      "stargazingTrip": 78,
      "clearSkyScore": 74,
      "darknessScore": 89,
      "dewScore": 98,
      "elevationScore": 40,
      "temperatureComfortScore": 100,
      "windComfortScore": 25,
      "rainComfortScore": 48,
      "accessScore": 64,
      "confidenceScore": 100,
      "confidenceLevel": "high",
      "reasons": [
        "Clear-sky climatology score: 74",
        "Calibrated darkness score: 89"
      ],
      "caveats": [
        "Temperature comfort uses the monthly astronomical-night mean, not hourly utility"
      ]
    },
    {
      "siteId": "akasaki-promenade",
      "month": 2,
      "skyQuality": 80,
      "tripComfort": 67,
      "stargazingTrip": 77,
      "clearSkyScore": 71,
      "darknessScore": 89,
      "dewScore": 98,
      "elevationScore": 40,
      "temperatureComfortScore": 100,
      "windComfortScore": 30,
      "rainComfortScore": 45,
      "accessScore": 64,
      "confidenceScore": 100,
      "confidenceLevel": "high",
      "reasons": [
        "Clear-sky climatology score: 71",
        "Calibrated darkness score: 89"
      ],
      "caveats": [
        "Temperature comfort uses the monthly astronomical-night mean, not hourly utility"
      ]
    },
    {
      "siteId": "akasaki-promenade",
      "month": 3,
      "skyQuality": 75,
      "tripComfort": 67,
      "stargazingTrip": 73,
      "clearSkyScore": 61,
      "darknessScore": 89,
      "dewScore": 96,
      "elevationScore": 40,
      "temperatureComfortScore": 100,
      "windComfortScore": 33,
      "rainComfortScore": 35,
      "accessScore": 64,
      "confidenceScore": 100,
      "confidenceLevel": "high",
      "reasons": [
        "Clear-sky climatology score: 61",
        "Calibrated darkness score: 89"
      ],
      "caveats": [
        "Temperature comfort uses the monthly astronomical-night mean, not hourly utility"
      ]
    },
    {
      "siteId": "akasaki-promenade",
      "month": 4,
      "skyQuality": 72,
      "tripComfort": 70,
      "stargazingTrip": 72,
      "clearSkyScore": 57,
      "darknessScore": 89,
      "dewScore": 90,
      "elevationScore": 40,
      "temperatureComfortScore": 100,
      "windComfortScore": 40,
      "rainComfortScore": 45,
      "accessScore": 64,
      "confidenceScore": 100,
      "confidenceLevel": "high",
      "reasons": [
        "Clear-sky climatology score: 57",
        "Calibrated darkness score: 89"
      ],
      "caveats": [
        "Temperature comfort uses the monthly astronomical-night mean, not hourly utility"
      ]
    },
    {
      "siteId": "akasaki-promenade",
      "month": 5,
      "skyQuality": 64,
      "tripComfort": 75,
      "stargazingTrip": 66,
      "clearSkyScore": 40,
      "darknessScore": 89,
      "dewScore": 79,
      "elevationScore": 40,
      "temperatureComfortScore": 98,
      "windComfortScore": 56,
      "rainComfortScore": 47,
      "accessScore": 64,
      "confidenceScore": 100,
      "confidenceLevel": "high",
      "reasons": [
        "Clear-sky climatology score: 40",
        "Calibrated darkness score: 89"
      ],
      "caveats": [
        "Temperature comfort uses the monthly astronomical-night mean, not hourly utility"
      ]
    },
    {
      "siteId": "akasaki-promenade",
      "month": 6,
      "skyQuality": 50,
      "tripComfort": 73,
      "stargazingTrip": 55,
      "clearSkyScore": 18,
      "darknessScore": 89,
      "dewScore": 43,
      "elevationScore": 40,
      "temperatureComfortScore": 95,
      "windComfortScore": 62,
      "rainComfortScore": 35,
      "accessScore": 64,
      "confidenceScore": 100,
      "confidenceLevel": "high",
      "reasons": [
        "Clear-sky climatology score: 18",
        "Calibrated darkness score: 89"
      ],
      "caveats": [
        "Temperature comfort uses the monthly astronomical-night mean, not hourly utility"
      ]
    },
    {
      "siteId": "akasaki-promenade",
      "month": 7,
      "skyQuality": 55,
      "tripComfort": 69,
      "stargazingTrip": 57,
      "clearSkyScore": 32,
      "darknessScore": 89,
      "dewScore": 23,
      "elevationScore": 40,
      "temperatureComfortScore": 85,
      "windComfortScore": 61,
      "rainComfortScore": 40,
      "accessScore": 64,
      "confidenceScore": 100,
      "confidenceLevel": "high",
      "reasons": [
        "Clear-sky climatology score: 32",
        "Calibrated darkness score: 89"
      ],
      "caveats": [
        "Temperature comfort uses the monthly astronomical-night mean, not hourly utility"
      ]
    },
    {
      "siteId": "akasaki-promenade",
      "month": 8,
      "skyQuality": 66,
      "tripComfort": 68,
      "stargazingTrip": 66,
      "clearSkyScore": 53,
      "darknessScore": 89,
      "dewScore": 47,
      "elevationScore": 40,
      "temperatureComfortScore": 78,
      "windComfortScore": 67,
      "rainComfortScore": 39,
      "accessScore": 64,
      "confidenceScore": 100,
      "confidenceLevel": "high",
      "reasons": [
        "Clear-sky climatology score: 53",
        "Calibrated darkness score: 89"
      ],
      "caveats": [
        "Temperature comfort uses the monthly astronomical-night mean, not hourly utility"
      ]
    },
    {
      "siteId": "akasaki-promenade",
      "month": 9,
      "skyQuality": 66,
      "tripComfort": 65,
      "stargazingTrip": 66,
      "clearSkyScore": 46,
      "darknessScore": 89,
      "dewScore": 80,
      "elevationScore": 40,
      "temperatureComfortScore": 86,
      "windComfortScore": 53,
      "rainComfortScore": 27,
      "accessScore": 64,
      "confidenceScore": 100,
      "confidenceLevel": "high",
      "reasons": [
        "Clear-sky climatology score: 46",
        "Calibrated darkness score: 89"
      ],
      "caveats": [
        "Temperature comfort uses the monthly astronomical-night mean, not hourly utility"
      ]
    },
    {
      "siteId": "akasaki-promenade",
      "month": 10,
      "skyQuality": 71,
      "tripComfort": 66,
      "stargazingTrip": 70,
      "clearSkyScore": 53,
      "darknessScore": 89,
      "dewScore": 94,
      "elevationScore": 40,
      "temperatureComfortScore": 96,
      "windComfortScore": 38,
      "rainComfortScore": 35,
      "accessScore": 64,
      "confidenceScore": 100,
      "confidenceLevel": "high",
      "reasons": [
        "Clear-sky climatology score: 53",
        "Calibrated darkness score: 89"
      ],
      "caveats": [
        "Temperature comfort uses the monthly astronomical-night mean, not hourly utility"
      ]
    },
    {
      "siteId": "akasaki-promenade",
      "month": 11,
      "skyQuality": 75,
      "tripComfort": 68,
      "stargazingTrip": 74,
      "clearSkyScore": 62,
      "darknessScore": 89,
      "dewScore": 97,
      "elevationScore": 40,
      "temperatureComfortScore": 100,
      "windComfortScore": 37,
      "rainComfortScore": 38,
      "accessScore": 64,
      "confidenceScore": 100,
      "confidenceLevel": "high",
      "reasons": [
        "Clear-sky climatology score: 62",
        "Calibrated darkness score: 89"
      ],
      "caveats": [
        "Temperature comfort uses the monthly astronomical-night mean, not hourly utility"
      ]
    },
    {
      "siteId": "akasaki-promenade",
      "month": 12,
      "skyQuality": 82,
      "tripComfort": 67,
      "stargazingTrip": 79,
      "clearSkyScore": 76,
      "darknessScore": 89,
      "dewScore": 99,
      "elevationScore": 40,
      "temperatureComfortScore": 100,
      "windComfortScore": 27,
      "rainComfortScore": 49,
      "accessScore": 64,
      "confidenceScore": 100,
      "confidenceLevel": "high",
      "reasons": [
        "Clear-sky climatology score: 76",
        "Calibrated darkness score: 89"
      ],
      "caveats": [
        "Temperature comfort uses the monthly astronomical-night mean, not hourly utility"
      ]
    }
  ]
}
