{
  "siteId": "turkey-creek-trailhead-night",
  "algorithmVersion": "site-score-1.1.0",
  "generatedAt": "2026-09-01T01:37:43.222436Z",
  "months": [
    {
      "siteId": "turkey-creek-trailhead-night",
      "month": 1,
      "skyQuality": 85,
      "tripComfort": 75,
      "stargazingTrip": 83,
      "clearSkyScore": 90,
      "darknessScore": 80,
      "dewScore": 86,
      "elevationScore": 83,
      "temperatureComfortScore": 62,
      "windComfortScore": 100,
      "rainComfortScore": 68,
      "accessScore": 68,
      "confidenceScore": 100,
      "confidenceLevel": "high",
      "reasons": [
        "Clear-sky climatology score: 90",
        "Calibrated darkness score: 80"
      ],
      "caveats": [
        "Temperature comfort uses the monthly astronomical-night mean, not hourly utility"
      ]
    },
    {
      "siteId": "turkey-creek-trailhead-night",
      "month": 2,
      "skyQuality": 84,
      "tripComfort": 77,
      "stargazingTrip": 83,
      "clearSkyScore": 87,
      "darknessScore": 80,
      "dewScore": 85,
      "elevationScore": 83,
      "temperatureComfortScore": 68,
      "windComfortScore": 100,
      "rainComfortScore": 66,
      "accessScore": 68,
      "confidenceScore": 100,
      "confidenceLevel": "high",
      "reasons": [
        "Clear-sky climatology score: 87",
        "Calibrated darkness score: 80"
      ],
      "caveats": [
        "Temperature comfort uses the monthly astronomical-night mean, not hourly utility"
      ]
    },
    {
      "siteId": "turkey-creek-trailhead-night",
      "month": 3,
      "skyQuality": 87,
      "tripComfort": 84,
      "stargazingTrip": 86,
      "clearSkyScore": 93,
      "darknessScore": 80,
      "dewScore": 89,
      "elevationScore": 83,
      "temperatureComfortScore": 81,
      "windComfortScore": 100,
      "rainComfortScore": 73,
      "accessScore": 68,
      "confidenceScore": 100,
      "confidenceLevel": "high",
      "reasons": [
        "Clear-sky climatology score: 93",
        "Calibrated darkness score: 80"
      ],
      "caveats": [
        "Temperature comfort uses the monthly astronomical-night mean, not hourly utility"
      ]
    },
    {
      "siteId": "turkey-creek-trailhead-night",
      "month": 4,
      "skyQuality": 90,
      "tripComfort": 93,
      "stargazingTrip": 91,
      "clearSkyScore": 99,
      "darknessScore": 80,
      "dewScore": 95,
      "elevationScore": 83,
      "temperatureComfortScore": 96,
      "windComfortScore": 100,
      "rainComfortScore": 87,
      "accessScore": 68,
      "confidenceScore": 100,
      "confidenceLevel": "high",
      "reasons": [
        "Clear-sky climatology score: 99",
        "Calibrated darkness score: 80"
      ],
      "caveats": [
        "Temperature comfort uses the monthly astronomical-night mean, not hourly utility"
      ]
    },
    {
      "siteId": "turkey-creek-trailhead-night",
      "month": 5,
      "skyQuality": 91,
      "tripComfort": 96,
      "stargazingTrip": 92,
      "clearSkyScore": 100,
      "darknessScore": 80,
      "dewScore": 98,
      "elevationScore": 83,
      "temperatureComfortScore": 100,
      "windComfortScore": 100,
      "rainComfortScore": 95,
      "accessScore": 68,
      "confidenceScore": 100,
      "confidenceLevel": "high",
      "reasons": [
        "Clear-sky climatology score: 100",
        "Calibrated darkness score: 80"
      ],
      "caveats": [
        "Temperature comfort uses the monthly astronomical-night mean, not hourly utility"
      ]
    },
    {
      "siteId": "turkey-creek-trailhead-night",
      "month": 6,
      "skyQuality": 91,
      "tripComfort": 96,
      "stargazingTrip": 92,
      "clearSkyScore": 100,
      "darknessScore": 80,
      "dewScore": 100,
      "elevationScore": 83,
      "temperatureComfortScore": 98,
      "windComfortScore": 100,
      "rainComfortScore": 99,
      "accessScore": 68,
      "confidenceScore": 100,
      "confidenceLevel": "high",
      "reasons": [
        "Clear-sky climatology score: 100",
        "Calibrated darkness score: 80"
      ],
      "caveats": [
        "Temperature comfort uses the monthly astronomical-night mean, not hourly utility"
      ]
    },
    {
      "siteId": "turkey-creek-trailhead-night",
      "month": 7,
      "skyQuality": 83,
      "tripComfort": 93,
      "stargazingTrip": 85,
      "clearSkyScore": 83,
      "darknessScore": 80,
      "dewScore": 96,
      "elevationScore": 83,
      "temperatureComfortScore": 95,
      "windComfortScore": 100,
      "rainComfortScore": 92,
      "accessScore": 68,
      "confidenceScore": 100,
      "confidenceLevel": "high",
      "reasons": [
        "Clear-sky climatology score: 83",
        "Calibrated darkness score: 80"
      ],
      "caveats": [
        "Temperature comfort uses the monthly astronomical-night mean, not hourly utility"
      ]
    },
    {
      "siteId": "turkey-creek-trailhead-night",
      "month": 8,
      "skyQuality": 87,
      "tripComfort": 94,
      "stargazingTrip": 88,
      "clearSkyScore": 91,
      "darknessScore": 80,
      "dewScore": 96,
      "elevationScore": 83,
      "temperatureComfortScore": 97,
      "windComfortScore": 100,
      "rainComfortScore": 93,
      "accessScore": 68,
      "confidenceScore": 100,
      "confidenceLevel": "high",
      "reasons": [
        "Clear-sky climatology score: 91",
        "Calibrated darkness score: 80"
      ],
      "caveats": [
        "Temperature comfort uses the monthly astronomical-night mean, not hourly utility"
      ]
    },
    {
      "siteId": "turkey-creek-trailhead-night",
      "month": 9,
      "skyQuality": 91,
      "tripComfort": 96,
      "stargazingTrip": 92,
      "clearSkyScore": 100,
      "darknessScore": 80,
      "dewScore": 97,
      "elevationScore": 83,
      "temperatureComfortScore": 100,
      "windComfortScore": 100,
      "rainComfortScore": 92,
      "accessScore": 68,
      "confidenceScore": 100,
      "confidenceLevel": "high",
      "reasons": [
        "Clear-sky climatology score: 100",
        "Calibrated darkness score: 80"
      ],
      "caveats": [
        "Temperature comfort uses the monthly astronomical-night mean, not hourly utility"
      ]
    },
    {
      "siteId": "turkey-creek-trailhead-night",
      "month": 10,
      "skyQuality": 91,
      "tripComfort": 95,
      "stargazingTrip": 91,
      "clearSkyScore": 100,
      "darknessScore": 80,
      "dewScore": 95,
      "elevationScore": 83,
      "temperatureComfortScore": 100,
      "windComfortScore": 100,
      "rainComfortScore": 87,
      "accessScore": 68,
      "confidenceScore": 100,
      "confidenceLevel": "high",
      "reasons": [
        "Clear-sky climatology score: 100",
        "Calibrated darkness score: 80"
      ],
      "caveats": [
        "Temperature comfort uses the monthly astronomical-night mean, not hourly utility"
      ]
    },
    {
      "siteId": "turkey-creek-trailhead-night",
      "month": 11,
      "skyQuality": 89,
      "tripComfort": 85,
      "stargazingTrip": 88,
      "clearSkyScore": 97,
      "darknessScore": 80,
      "dewScore": 93,
      "elevationScore": 83,
      "temperatureComfortScore": 82,
      "windComfortScore": 100,
      "rainComfortScore": 80,
      "accessScore": 68,
      "confidenceScore": 100,
      "confidenceLevel": "high",
      "reasons": [
        "Clear-sky climatology score: 97",
        "Calibrated darkness score: 80"
      ],
      "caveats": [
        "Temperature comfort uses the monthly astronomical-night mean, not hourly utility"
      ]
    },
    {
      "siteId": "turkey-creek-trailhead-night",
      "month": 12,
      "skyQuality": 86,
      "tripComfort": 76,
      "stargazingTrip": 84,
      "clearSkyScore": 92,
      "darknessScore": 80,
      "dewScore": 86,
      "elevationScore": 83,
      "temperatureComfortScore": 62,
      "windComfortScore": 100,
      "rainComfortScore": 71,
      "accessScore": 68,
      "confidenceScore": 100,
      "confidenceLevel": "high",
      "reasons": [
        "Clear-sky climatology score: 92",
        "Calibrated darkness score: 80"
      ],
      "caveats": [
        "Temperature comfort uses the monthly astronomical-night mean, not hourly utility"
      ]
    }
  ]
}
