{
  "siteId": "craig-goch-dam",
  "algorithmVersion": "site-score-1.1.0",
  "generatedAt": "2026-08-26T20:47:16.319612Z",
  "months": [
    {
      "siteId": "craig-goch-dam",
      "month": 1,
      "skyQuality": 47,
      "tripComfort": 74,
      "stargazingTrip": 53,
      "clearSkyScore": 18,
      "darknessScore": 89,
      "dewScore": 9,
      "elevationScore": 58,
      "temperatureComfortScore": 76,
      "windComfortScore": 87,
      "rainComfortScore": 37,
      "accessScore": 78,
      "confidenceScore": 99,
      "confidenceLevel": "high",
      "reasons": [
        "Clear-sky climatology score: 18",
        "Calibrated darkness score: 89"
      ],
      "caveats": [
        "Temperature comfort uses the monthly astronomical-night mean, not hourly utility"
      ]
    },
    {
      "siteId": "craig-goch-dam",
      "month": 2,
      "skyQuality": 51,
      "tripComfort": 74,
      "stargazingTrip": 55,
      "clearSkyScore": 25,
      "darknessScore": 89,
      "dewScore": 11,
      "elevationScore": 58,
      "temperatureComfortScore": 74,
      "windComfortScore": 89,
      "rainComfortScore": 40,
      "accessScore": 78,
      "confidenceScore": 99,
      "confidenceLevel": "high",
      "reasons": [
        "Clear-sky climatology score: 25",
        "Calibrated darkness score: 89"
      ],
      "caveats": [
        "Temperature comfort uses the monthly astronomical-night mean, not hourly utility"
      ]
    },
    {
      "siteId": "craig-goch-dam",
      "month": 3,
      "skyQuality": 50,
      "tripComfort": 78,
      "stargazingTrip": 56,
      "clearSkyScore": 23,
      "darknessScore": 89,
      "dewScore": 13,
      "elevationScore": 58,
      "temperatureComfortScore": 78,
      "windComfortScore": 92,
      "rainComfortScore": 48,
      "accessScore": 78,
      "confidenceScore": 99,
      "confidenceLevel": "high",
      "reasons": [
        "Clear-sky climatology score: 23",
        "Calibrated darkness score: 89"
      ],
      "caveats": [
        "Temperature comfort uses the monthly astronomical-night mean, not hourly utility"
      ]
    },
    {
      "siteId": "craig-goch-dam",
      "month": 4,
      "skyQuality": 54,
      "tripComfort": 83,
      "stargazingTrip": 60,
      "clearSkyScore": 30,
      "darknessScore": 89,
      "dewScore": 17,
      "elevationScore": 58,
      "temperatureComfortScore": 84,
      "windComfortScore": 96,
      "rainComfortScore": 57,
      "accessScore": 78,
      "confidenceScore": 99,
      "confidenceLevel": "high",
      "reasons": [
        "Clear-sky climatology score: 30",
        "Calibrated darkness score: 89"
      ],
      "caveats": [
        "Temperature comfort uses the monthly astronomical-night mean, not hourly utility"
      ]
    },
    {
      "siteId": "craig-goch-dam",
      "month": 5,
      "skyQuality": 48,
      "tripComfort": 87,
      "stargazingTrip": 56,
      "clearSkyScore": 17,
      "darknessScore": 89,
      "dewScore": 18,
      "elevationScore": 58,
      "temperatureComfortScore": 92,
      "windComfortScore": 96,
      "rainComfortScore": 60,
      "accessScore": 78,
      "confidenceScore": 99,
      "confidenceLevel": "high",
      "reasons": [
        "Clear-sky climatology score: 17",
        "Calibrated darkness score: 89"
      ],
      "caveats": [
        "Temperature comfort uses the monthly astronomical-night mean, not hourly utility"
      ]
    },
    {
      "siteId": "craig-goch-dam",
      "month": 6,
      "skyQuality": 0,
      "tripComfort": 0,
      "stargazingTrip": 0,
      "clearSkyScore": 0,
      "darknessScore": 89,
      "dewScore": 0,
      "elevationScore": 0,
      "temperatureComfortScore": 0,
      "windComfortScore": 0,
      "rainComfortScore": 0,
      "accessScore": 78,
      "confidenceScore": 99,
      "confidenceLevel": "high",
      "reasons": [
        "No usable astronomical night in this climate-normal month"
      ],
      "caveats": [
        "Stargazing score is forced to zero when ERA5 contains no astronomical-night hours"
      ]
    },
    {
      "siteId": "craig-goch-dam",
      "month": 7,
      "skyQuality": 43,
      "tripComfort": 92,
      "stargazingTrip": 53,
      "clearSkyScore": 10,
      "darknessScore": 89,
      "dewScore": 5,
      "elevationScore": 58,
      "temperatureComfortScore": 100,
      "windComfortScore": 98,
      "rainComfortScore": 63,
      "accessScore": 78,
      "confidenceScore": 99,
      "confidenceLevel": "high",
      "reasons": [
        "Clear-sky climatology score: 10",
        "Calibrated darkness score: 89"
      ],
      "caveats": [
        "Temperature comfort uses the monthly astronomical-night mean, not hourly utility"
      ]
    },
    {
      "siteId": "craig-goch-dam",
      "month": 8,
      "skyQuality": 45,
      "tripComfort": 91,
      "stargazingTrip": 54,
      "clearSkyScore": 13,
      "darknessScore": 89,
      "dewScore": 6,
      "elevationScore": 58,
      "temperatureComfortScore": 100,
      "windComfortScore": 98,
      "rainComfortScore": 57,
      "accessScore": 78,
      "confidenceScore": 99,
      "confidenceLevel": "high",
      "reasons": [
        "Clear-sky climatology score: 13",
        "Calibrated darkness score: 89"
      ],
      "caveats": [
        "Temperature comfort uses the monthly astronomical-night mean, not hourly utility"
      ]
    },
    {
      "siteId": "craig-goch-dam",
      "month": 9,
      "skyQuality": 49,
      "tripComfort": 90,
      "stargazingTrip": 57,
      "clearSkyScore": 22,
      "darknessScore": 89,
      "dewScore": 7,
      "elevationScore": 58,
      "temperatureComfortScore": 100,
      "windComfortScore": 96,
      "rainComfortScore": 53,
      "accessScore": 78,
      "confidenceScore": 99,
      "confidenceLevel": "high",
      "reasons": [
        "Clear-sky climatology score: 22",
        "Calibrated darkness score: 89"
      ],
      "caveats": [
        "Temperature comfort uses the monthly astronomical-night mean, not hourly utility"
      ]
    },
    {
      "siteId": "craig-goch-dam",
      "month": 10,
      "skyQuality": 47,
      "tripComfort": 85,
      "stargazingTrip": 55,
      "clearSkyScore": 18,
      "darknessScore": 89,
      "dewScore": 8,
      "elevationScore": 58,
      "temperatureComfortScore": 96,
      "windComfortScore": 92,
      "rainComfortScore": 41,
      "accessScore": 78,
      "confidenceScore": 99,
      "confidenceLevel": "high",
      "reasons": [
        "Clear-sky climatology score: 18",
        "Calibrated darkness score: 89"
      ],
      "caveats": [
        "Temperature comfort uses the monthly astronomical-night mean, not hourly utility"
      ]
    },
    {
      "siteId": "craig-goch-dam",
      "month": 11,
      "skyQuality": 46,
      "tripComfort": 79,
      "stargazingTrip": 53,
      "clearSkyScore": 16,
      "darknessScore": 89,
      "dewScore": 6,
      "elevationScore": 58,
      "temperatureComfortScore": 86,
      "windComfortScore": 91,
      "rainComfortScore": 34,
      "accessScore": 78,
      "confidenceScore": 99,
      "confidenceLevel": "high",
      "reasons": [
        "Clear-sky climatology score: 16",
        "Calibrated darkness score: 89"
      ],
      "caveats": [
        "Temperature comfort uses the monthly astronomical-night mean, not hourly utility"
      ]
    },
    {
      "siteId": "craig-goch-dam",
      "month": 12,
      "skyQuality": 47,
      "tripComfort": 74,
      "stargazingTrip": 52,
      "clearSkyScore": 17,
      "darknessScore": 89,
      "dewScore": 8,
      "elevationScore": 58,
      "temperatureComfortScore": 77,
      "windComfortScore": 88,
      "rainComfortScore": 33,
      "accessScore": 78,
      "confidenceScore": 99,
      "confidenceLevel": "high",
      "reasons": [
        "Clear-sky climatology score: 17",
        "Calibrated darkness score: 89"
      ],
      "caveats": [
        "Temperature comfort uses the monthly astronomical-night mean, not hourly utility"
      ]
    }
  ]
}
