{
  "siteId": "redfish-lake",
  "algorithmVersion": "site-score-1.1.0",
  "generatedAt": "2026-09-08T13:49:13.781738Z",
  "months": [
    {
      "siteId": "redfish-lake",
      "month": 1,
      "skyQuality": 67,
      "tripComfort": 54,
      "stargazingTrip": 64,
      "clearSkyScore": 43,
      "darknessScore": 99,
      "dewScore": 33,
      "elevationScore": 96,
      "temperatureComfortScore": 25,
      "windComfortScore": 100,
      "rainComfortScore": 38,
      "accessScore": 72,
      "confidenceScore": 84,
      "confidenceLevel": "moderate",
      "reasons": [
        "Clear-sky climatology score: 43",
        "Calibrated darkness score: 99"
      ],
      "caveats": [
        "Temperature comfort uses the monthly astronomical-night mean, not hourly utility",
        "High-elevation temperature and wind come from the coarse ERA5 grid and are not a summit forecast; confidence is capped at moderate"
      ]
    },
    {
      "siteId": "redfish-lake",
      "month": 2,
      "skyQuality": 69,
      "tripComfort": 56,
      "stargazingTrip": 67,
      "clearSkyScore": 47,
      "darknessScore": 99,
      "dewScore": 37,
      "elevationScore": 96,
      "temperatureComfortScore": 29,
      "windComfortScore": 100,
      "rainComfortScore": 38,
      "accessScore": 72,
      "confidenceScore": 84,
      "confidenceLevel": "moderate",
      "reasons": [
        "Clear-sky climatology score: 47",
        "Calibrated darkness score: 99"
      ],
      "caveats": [
        "Temperature comfort uses the monthly astronomical-night mean, not hourly utility",
        "High-elevation temperature and wind come from the coarse ERA5 grid and are not a summit forecast; confidence is capped at moderate"
      ]
    },
    {
      "siteId": "redfish-lake",
      "month": 3,
      "skyQuality": 73,
      "tripComfort": 61,
      "stargazingTrip": 70,
      "clearSkyScore": 53,
      "darknessScore": 99,
      "dewScore": 46,
      "elevationScore": 96,
      "temperatureComfortScore": 40,
      "windComfortScore": 100,
      "rainComfortScore": 40,
      "accessScore": 72,
      "confidenceScore": 84,
      "confidenceLevel": "moderate",
      "reasons": [
        "Clear-sky climatology score: 53",
        "Calibrated darkness score: 99"
      ],
      "caveats": [
        "Temperature comfort uses the monthly astronomical-night mean, not hourly utility",
        "High-elevation temperature and wind come from the coarse ERA5 grid and are not a summit forecast; confidence is capped at moderate"
      ]
    },
    {
      "siteId": "redfish-lake",
      "month": 4,
      "skyQuality": 76,
      "tripComfort": 67,
      "stargazingTrip": 74,
      "clearSkyScore": 59,
      "darknessScore": 99,
      "dewScore": 49,
      "elevationScore": 96,
      "temperatureComfortScore": 48,
      "windComfortScore": 100,
      "rainComfortScore": 53,
      "accessScore": 72,
      "confidenceScore": 84,
      "confidenceLevel": "moderate",
      "reasons": [
        "Clear-sky climatology score: 59",
        "Calibrated darkness score: 99"
      ],
      "caveats": [
        "Temperature comfort uses the monthly astronomical-night mean, not hourly utility",
        "High-elevation temperature and wind come from the coarse ERA5 grid and are not a summit forecast; confidence is capped at moderate"
      ]
    },
    {
      "siteId": "redfish-lake",
      "month": 5,
      "skyQuality": 78,
      "tripComfort": 74,
      "stargazingTrip": 77,
      "clearSkyScore": 63,
      "darknessScore": 99,
      "dewScore": 54,
      "elevationScore": 96,
      "temperatureComfortScore": 60,
      "windComfortScore": 100,
      "rainComfortScore": 67,
      "accessScore": 72,
      "confidenceScore": 84,
      "confidenceLevel": "moderate",
      "reasons": [
        "Clear-sky climatology score: 63",
        "Calibrated darkness score: 99"
      ],
      "caveats": [
        "Temperature comfort uses the monthly astronomical-night mean, not hourly utility",
        "High-elevation temperature and wind come from the coarse ERA5 grid and are not a summit forecast; confidence is capped at moderate"
      ]
    },
    {
      "siteId": "redfish-lake",
      "month": 6,
      "skyQuality": 86,
      "tripComfort": 86,
      "stargazingTrip": 86,
      "clearSkyScore": 78,
      "darknessScore": 99,
      "dewScore": 67,
      "elevationScore": 96,
      "temperatureComfortScore": 83,
      "windComfortScore": 100,
      "rainComfortScore": 77,
      "accessScore": 72,
      "confidenceScore": 84,
      "confidenceLevel": "moderate",
      "reasons": [
        "Clear-sky climatology score: 78",
        "Calibrated darkness score: 99"
      ],
      "caveats": [
        "Temperature comfort uses the monthly astronomical-night mean, not hourly utility",
        "High-elevation temperature and wind come from the coarse ERA5 grid and are not a summit forecast; confidence is capped at moderate"
      ]
    },
    {
      "siteId": "redfish-lake",
      "month": 7,
      "skyQuality": 98,
      "tripComfort": 97,
      "stargazingTrip": 98,
      "clearSkyScore": 99,
      "darknessScore": 99,
      "dewScore": 92,
      "elevationScore": 96,
      "temperatureComfortScore": 100,
      "windComfortScore": 100,
      "rainComfortScore": 97,
      "accessScore": 72,
      "confidenceScore": 84,
      "confidenceLevel": "moderate",
      "reasons": [
        "Clear-sky climatology score: 99",
        "Calibrated darkness score: 99"
      ],
      "caveats": [
        "Temperature comfort uses the monthly astronomical-night mean, not hourly utility",
        "High-elevation temperature and wind come from the coarse ERA5 grid and are not a summit forecast; confidence is capped at moderate"
      ]
    },
    {
      "siteId": "redfish-lake",
      "month": 8,
      "skyQuality": 98,
      "tripComfort": 96,
      "stargazingTrip": 97,
      "clearSkyScore": 99,
      "darknessScore": 99,
      "dewScore": 91,
      "elevationScore": 96,
      "temperatureComfortScore": 99,
      "windComfortScore": 100,
      "rainComfortScore": 93,
      "accessScore": 72,
      "confidenceScore": 84,
      "confidenceLevel": "moderate",
      "reasons": [
        "Clear-sky climatology score: 99",
        "Calibrated darkness score: 99"
      ],
      "caveats": [
        "Temperature comfort uses the monthly astronomical-night mean, not hourly utility",
        "High-elevation temperature and wind come from the coarse ERA5 grid and are not a summit forecast; confidence is capped at moderate"
      ]
    },
    {
      "siteId": "redfish-lake",
      "month": 9,
      "skyQuality": 95,
      "tripComfort": 87,
      "stargazingTrip": 93,
      "clearSkyScore": 94,
      "darknessScore": 99,
      "dewScore": 82,
      "elevationScore": 96,
      "temperatureComfortScore": 82,
      "windComfortScore": 100,
      "rainComfortScore": 82,
      "accessScore": 72,
      "confidenceScore": 84,
      "confidenceLevel": "moderate",
      "reasons": [
        "Clear-sky climatology score: 94",
        "Calibrated darkness score: 99"
      ],
      "caveats": [
        "Temperature comfort uses the monthly astronomical-night mean, not hourly utility",
        "High-elevation temperature and wind come from the coarse ERA5 grid and are not a summit forecast; confidence is capped at moderate"
      ]
    },
    {
      "siteId": "redfish-lake",
      "month": 10,
      "skyQuality": 86,
      "tripComfort": 71,
      "stargazingTrip": 83,
      "clearSkyScore": 79,
      "darknessScore": 99,
      "dewScore": 63,
      "elevationScore": 96,
      "temperatureComfortScore": 54,
      "windComfortScore": 100,
      "rainComfortScore": 65,
      "accessScore": 72,
      "confidenceScore": 84,
      "confidenceLevel": "moderate",
      "reasons": [
        "Clear-sky climatology score: 79",
        "Calibrated darkness score: 99"
      ],
      "caveats": [
        "Temperature comfort uses the monthly astronomical-night mean, not hourly utility",
        "High-elevation temperature and wind come from the coarse ERA5 grid and are not a summit forecast; confidence is capped at moderate"
      ]
    },
    {
      "siteId": "redfish-lake",
      "month": 11,
      "skyQuality": 71,
      "tripComfort": 57,
      "stargazingTrip": 68,
      "clearSkyScore": 52,
      "darknessScore": 99,
      "dewScore": 36,
      "elevationScore": 96,
      "temperatureComfortScore": 30,
      "windComfortScore": 100,
      "rainComfortScore": 41,
      "accessScore": 72,
      "confidenceScore": 84,
      "confidenceLevel": "moderate",
      "reasons": [
        "Clear-sky climatology score: 52",
        "Calibrated darkness score: 99"
      ],
      "caveats": [
        "Temperature comfort uses the monthly astronomical-night mean, not hourly utility",
        "High-elevation temperature and wind come from the coarse ERA5 grid and are not a summit forecast; confidence is capped at moderate"
      ]
    },
    {
      "siteId": "redfish-lake",
      "month": 12,
      "skyQuality": 68,
      "tripComfort": 52,
      "stargazingTrip": 65,
      "clearSkyScore": 46,
      "darknessScore": 99,
      "dewScore": 33,
      "elevationScore": 96,
      "temperatureComfortScore": 21,
      "windComfortScore": 100,
      "rainComfortScore": 33,
      "accessScore": 72,
      "confidenceScore": 84,
      "confidenceLevel": "moderate",
      "reasons": [
        "Clear-sky climatology score: 46",
        "Calibrated darkness score: 99"
      ],
      "caveats": [
        "Temperature comfort uses the monthly astronomical-night mean, not hourly utility",
        "High-elevation temperature and wind come from the coarse ERA5 grid and are not a summit forecast; confidence is capped at moderate"
      ]
    }
  ]
}
