{
  "siteId": "melote-house-lapalala",
  "algorithmVersion": "site-score-1.1.0",
  "generatedAt": "2026-09-08T13:48:59.603096Z",
  "months": [
    {
      "siteId": "melote-house-lapalala",
      "month": 1,
      "skyQuality": 78,
      "tripComfort": 90,
      "stargazingTrip": 81,
      "clearSkyScore": 67,
      "darknessScore": 89,
      "dewScore": 86,
      "elevationScore": 77,
      "temperatureComfortScore": 95,
      "windComfortScore": 98,
      "rainComfortScore": 62,
      "accessScore": 84,
      "confidenceScore": 100,
      "confidenceLevel": "high",
      "reasons": [
        "Clear-sky climatology score: 67",
        "Calibrated darkness score: 89"
      ],
      "caveats": [
        "Temperature comfort uses the monthly astronomical-night mean, not hourly utility"
      ]
    },
    {
      "siteId": "melote-house-lapalala",
      "month": 2,
      "skyQuality": 81,
      "tripComfort": 91,
      "stargazingTrip": 83,
      "clearSkyScore": 74,
      "darknessScore": 89,
      "dewScore": 86,
      "elevationScore": 77,
      "temperatureComfortScore": 95,
      "windComfortScore": 98,
      "rainComfortScore": 68,
      "accessScore": 84,
      "confidenceScore": 100,
      "confidenceLevel": "high",
      "reasons": [
        "Clear-sky climatology score: 74",
        "Calibrated darkness score: 89"
      ],
      "caveats": [
        "Temperature comfort uses the monthly astronomical-night mean, not hourly utility"
      ]
    },
    {
      "siteId": "melote-house-lapalala",
      "month": 3,
      "skyQuality": 87,
      "tripComfort": 93,
      "stargazingTrip": 88,
      "clearSkyScore": 87,
      "darknessScore": 89,
      "dewScore": 86,
      "elevationScore": 77,
      "temperatureComfortScore": 97,
      "windComfortScore": 99,
      "rainComfortScore": 76,
      "accessScore": 84,
      "confidenceScore": 100,
      "confidenceLevel": "high",
      "reasons": [
        "Clear-sky climatology score: 87",
        "Calibrated darkness score: 89"
      ],
      "caveats": [
        "Temperature comfort uses the monthly astronomical-night mean, not hourly utility"
      ]
    },
    {
      "siteId": "melote-house-lapalala",
      "month": 4,
      "skyQuality": 92,
      "tripComfort": 97,
      "stargazingTrip": 93,
      "clearSkyScore": 97,
      "darknessScore": 89,
      "dewScore": 85,
      "elevationScore": 77,
      "temperatureComfortScore": 100,
      "windComfortScore": 100,
      "rainComfortScore": 89,
      "accessScore": 84,
      "confidenceScore": 100,
      "confidenceLevel": "high",
      "reasons": [
        "Clear-sky climatology score: 97",
        "Calibrated darkness score: 89"
      ],
      "caveats": [
        "Temperature comfort uses the monthly astronomical-night mean, not hourly utility"
      ]
    },
    {
      "siteId": "melote-house-lapalala",
      "month": 5,
      "skyQuality": 94,
      "tripComfort": 98,
      "stargazingTrip": 94,
      "clearSkyScore": 100,
      "darknessScore": 89,
      "dewScore": 90,
      "elevationScore": 77,
      "temperatureComfortScore": 100,
      "windComfortScore": 100,
      "rainComfortScore": 96,
      "accessScore": 84,
      "confidenceScore": 100,
      "confidenceLevel": "high",
      "reasons": [
        "Clear-sky climatology score: 100",
        "Calibrated darkness score: 89"
      ],
      "caveats": [
        "Temperature comfort uses the monthly astronomical-night mean, not hourly utility"
      ]
    },
    {
      "siteId": "melote-house-lapalala",
      "month": 6,
      "skyQuality": 94,
      "tripComfort": 98,
      "stargazingTrip": 95,
      "clearSkyScore": 100,
      "darknessScore": 89,
      "dewScore": 91,
      "elevationScore": 77,
      "temperatureComfortScore": 100,
      "windComfortScore": 100,
      "rainComfortScore": 98,
      "accessScore": 84,
      "confidenceScore": 100,
      "confidenceLevel": "high",
      "reasons": [
        "Clear-sky climatology score: 100",
        "Calibrated darkness score: 89"
      ],
      "caveats": [
        "Temperature comfort uses the monthly astronomical-night mean, not hourly utility"
      ]
    },
    {
      "siteId": "melote-house-lapalala",
      "month": 7,
      "skyQuality": 94,
      "tripComfort": 98,
      "stargazingTrip": 95,
      "clearSkyScore": 100,
      "darknessScore": 89,
      "dewScore": 94,
      "elevationScore": 77,
      "temperatureComfortScore": 100,
      "windComfortScore": 100,
      "rainComfortScore": 99,
      "accessScore": 84,
      "confidenceScore": 100,
      "confidenceLevel": "high",
      "reasons": [
        "Clear-sky climatology score: 100",
        "Calibrated darkness score: 89"
      ],
      "caveats": [
        "Temperature comfort uses the monthly astronomical-night mean, not hourly utility"
      ]
    },
    {
      "siteId": "melote-house-lapalala",
      "month": 8,
      "skyQuality": 94,
      "tripComfort": 98,
      "stargazingTrip": 95,
      "clearSkyScore": 100,
      "darknessScore": 89,
      "dewScore": 96,
      "elevationScore": 77,
      "temperatureComfortScore": 100,
      "windComfortScore": 99,
      "rainComfortScore": 99,
      "accessScore": 84,
      "confidenceScore": 100,
      "confidenceLevel": "high",
      "reasons": [
        "Clear-sky climatology score: 100",
        "Calibrated darkness score: 89"
      ],
      "caveats": [
        "Temperature comfort uses the monthly astronomical-night mean, not hourly utility"
      ]
    },
    {
      "siteId": "melote-house-lapalala",
      "month": 9,
      "skyQuality": 94,
      "tripComfort": 97,
      "stargazingTrip": 95,
      "clearSkyScore": 100,
      "darknessScore": 89,
      "dewScore": 98,
      "elevationScore": 77,
      "temperatureComfortScore": 100,
      "windComfortScore": 98,
      "rainComfortScore": 96,
      "accessScore": 84,
      "confidenceScore": 100,
      "confidenceLevel": "high",
      "reasons": [
        "Clear-sky climatology score: 100",
        "Calibrated darkness score: 89"
      ],
      "caveats": [
        "Temperature comfort uses the monthly astronomical-night mean, not hourly utility"
      ]
    },
    {
      "siteId": "melote-house-lapalala",
      "month": 10,
      "skyQuality": 92,
      "tripComfort": 94,
      "stargazingTrip": 93,
      "clearSkyScore": 95,
      "darknessScore": 89,
      "dewScore": 97,
      "elevationScore": 77,
      "temperatureComfortScore": 97,
      "windComfortScore": 97,
      "rainComfortScore": 88,
      "accessScore": 84,
      "confidenceScore": 100,
      "confidenceLevel": "high",
      "reasons": [
        "Clear-sky climatology score: 95",
        "Calibrated darkness score: 89"
      ],
      "caveats": [
        "Temperature comfort uses the monthly astronomical-night mean, not hourly utility"
      ]
    },
    {
      "siteId": "melote-house-lapalala",
      "month": 11,
      "skyQuality": 79,
      "tripComfort": 92,
      "stargazingTrip": 82,
      "clearSkyScore": 68,
      "darknessScore": 89,
      "dewScore": 91,
      "elevationScore": 77,
      "temperatureComfortScore": 96,
      "windComfortScore": 98,
      "rainComfortScore": 74,
      "accessScore": 84,
      "confidenceScore": 100,
      "confidenceLevel": "high",
      "reasons": [
        "Clear-sky climatology score: 68",
        "Calibrated darkness score: 89"
      ],
      "caveats": [
        "Temperature comfort uses the monthly astronomical-night mean, not hourly utility"
      ]
    },
    {
      "siteId": "melote-house-lapalala",
      "month": 12,
      "skyQuality": 73,
      "tripComfort": 90,
      "stargazingTrip": 77,
      "clearSkyScore": 55,
      "darknessScore": 89,
      "dewScore": 88,
      "elevationScore": 77,
      "temperatureComfortScore": 95,
      "windComfortScore": 98,
      "rainComfortScore": 63,
      "accessScore": 84,
      "confidenceScore": 100,
      "confidenceLevel": "high",
      "reasons": [
        "Clear-sky climatology score: 55",
        "Calibrated darkness score: 89"
      ],
      "caveats": [
        "Temperature comfort uses the monthly astronomical-night mean, not hourly utility"
      ]
    }
  ]
}
