{
  "siteId": "hoshizora-park-bisei",
  "algorithmVersion": "site-score-1.1.0",
  "generatedAt": "2026-09-08T13:48:50.973984Z",
  "months": [
    {
      "siteId": "hoshizora-park-bisei",
      "month": 1,
      "skyQuality": 72,
      "tripComfort": 79,
      "stargazingTrip": 74,
      "clearSkyScore": 71,
      "darknessScore": 73,
      "dewScore": 82,
      "elevationScore": 55,
      "temperatureComfortScore": 69,
      "windComfortScore": 99,
      "rainComfortScore": 75,
      "accessScore": 72,
      "confidenceScore": 100,
      "confidenceLevel": "high",
      "reasons": [
        "Clear-sky climatology score: 71",
        "Calibrated darkness score: 73"
      ],
      "caveats": [
        "Temperature comfort uses the monthly astronomical-night mean, not hourly utility"
      ]
    },
    {
      "siteId": "hoshizora-park-bisei",
      "month": 2,
      "skyQuality": 71,
      "tripComfort": 79,
      "stargazingTrip": 72,
      "clearSkyScore": 68,
      "darknessScore": 73,
      "dewScore": 82,
      "elevationScore": 55,
      "temperatureComfortScore": 71,
      "windComfortScore": 99,
      "rainComfortScore": 67,
      "accessScore": 72,
      "confidenceScore": 100,
      "confidenceLevel": "high",
      "reasons": [
        "Clear-sky climatology score: 68",
        "Calibrated darkness score: 73"
      ],
      "caveats": [
        "Temperature comfort uses the monthly astronomical-night mean, not hourly utility"
      ]
    },
    {
      "siteId": "hoshizora-park-bisei",
      "month": 3,
      "skyQuality": 72,
      "tripComfort": 85,
      "stargazingTrip": 74,
      "clearSkyScore": 71,
      "darknessScore": 73,
      "dewScore": 81,
      "elevationScore": 55,
      "temperatureComfortScore": 85,
      "windComfortScore": 100,
      "rainComfortScore": 61,
      "accessScore": 72,
      "confidenceScore": 100,
      "confidenceLevel": "high",
      "reasons": [
        "Clear-sky climatology score: 71",
        "Calibrated darkness score: 73"
      ],
      "caveats": [
        "Temperature comfort uses the monthly astronomical-night mean, not hourly utility"
      ]
    },
    {
      "siteId": "hoshizora-park-bisei",
      "month": 4,
      "skyQuality": 69,
      "tripComfort": 91,
      "stargazingTrip": 74,
      "clearSkyScore": 66,
      "darknessScore": 73,
      "dewScore": 80,
      "elevationScore": 55,
      "temperatureComfortScore": 100,
      "windComfortScore": 100,
      "rainComfortScore": 59,
      "accessScore": 72,
      "confidenceScore": 100,
      "confidenceLevel": "high",
      "reasons": [
        "Clear-sky climatology score: 66",
        "Calibrated darkness score: 73"
      ],
      "caveats": [
        "Temperature comfort uses the monthly astronomical-night mean, not hourly utility"
      ]
    },
    {
      "siteId": "hoshizora-park-bisei",
      "month": 5,
      "skyQuality": 64,
      "tripComfort": 91,
      "stargazingTrip": 70,
      "clearSkyScore": 55,
      "darknessScore": 73,
      "dewScore": 78,
      "elevationScore": 55,
      "temperatureComfortScore": 100,
      "windComfortScore": 100,
      "rainComfortScore": 61,
      "accessScore": 72,
      "confidenceScore": 100,
      "confidenceLevel": "high",
      "reasons": [
        "Clear-sky climatology score: 55",
        "Calibrated darkness score: 73"
      ],
      "caveats": [
        "Temperature comfort uses the monthly astronomical-night mean, not hourly utility"
      ]
    },
    {
      "siteId": "hoshizora-park-bisei",
      "month": 6,
      "skyQuality": 47,
      "tripComfort": 89,
      "stargazingTrip": 55,
      "clearSkyScore": 20,
      "darknessScore": 73,
      "dewScore": 59,
      "elevationScore": 55,
      "temperatureComfortScore": 98,
      "windComfortScore": 100,
      "rainComfortScore": 51,
      "accessScore": 72,
      "confidenceScore": 100,
      "confidenceLevel": "high",
      "reasons": [
        "Clear-sky climatology score: 20",
        "Calibrated darkness score: 73"
      ],
      "caveats": [
        "Temperature comfort uses the monthly astronomical-night mean, not hourly utility"
      ]
    },
    {
      "siteId": "hoshizora-park-bisei",
      "month": 7,
      "skyQuality": 51,
      "tripComfort": 85,
      "stargazingTrip": 58,
      "clearSkyScore": 28,
      "darknessScore": 73,
      "dewScore": 63,
      "elevationScore": 55,
      "temperatureComfortScore": 88,
      "windComfortScore": 100,
      "rainComfortScore": 55,
      "accessScore": 72,
      "confidenceScore": 100,
      "confidenceLevel": "high",
      "reasons": [
        "Clear-sky climatology score: 28",
        "Calibrated darkness score: 73"
      ],
      "caveats": [
        "Temperature comfort uses the monthly astronomical-night mean, not hourly utility"
      ]
    },
    {
      "siteId": "hoshizora-park-bisei",
      "month": 8,
      "skyQuality": 59,
      "tripComfort": 86,
      "stargazingTrip": 65,
      "clearSkyScore": 44,
      "darknessScore": 73,
      "dewScore": 76,
      "elevationScore": 55,
      "temperatureComfortScore": 86,
      "windComfortScore": 100,
      "rainComfortScore": 66,
      "accessScore": 72,
      "confidenceScore": 100,
      "confidenceLevel": "high",
      "reasons": [
        "Clear-sky climatology score: 44",
        "Calibrated darkness score: 73"
      ],
      "caveats": [
        "Temperature comfort uses the monthly astronomical-night mean, not hourly utility"
      ]
    },
    {
      "siteId": "hoshizora-park-bisei",
      "month": 9,
      "skyQuality": 58,
      "tripComfort": 88,
      "stargazingTrip": 64,
      "clearSkyScore": 43,
      "darknessScore": 73,
      "dewScore": 66,
      "elevationScore": 55,
      "temperatureComfortScore": 97,
      "windComfortScore": 100,
      "rainComfortScore": 52,
      "accessScore": 72,
      "confidenceScore": 100,
      "confidenceLevel": "high",
      "reasons": [
        "Clear-sky climatology score: 43",
        "Calibrated darkness score: 73"
      ],
      "caveats": [
        "Temperature comfort uses the monthly astronomical-night mean, not hourly utility"
      ]
    },
    {
      "siteId": "hoshizora-park-bisei",
      "month": 10,
      "skyQuality": 71,
      "tripComfort": 92,
      "stargazingTrip": 75,
      "clearSkyScore": 71,
      "darknessScore": 73,
      "dewScore": 71,
      "elevationScore": 55,
      "temperatureComfortScore": 100,
      "windComfortScore": 100,
      "rainComfortScore": 66,
      "accessScore": 72,
      "confidenceScore": 100,
      "confidenceLevel": "high",
      "reasons": [
        "Clear-sky climatology score: 71",
        "Calibrated darkness score: 73"
      ],
      "caveats": [
        "Temperature comfort uses the monthly astronomical-night mean, not hourly utility"
      ]
    },
    {
      "siteId": "hoshizora-park-bisei",
      "month": 11,
      "skyQuality": 75,
      "tripComfort": 92,
      "stargazingTrip": 78,
      "clearSkyScore": 80,
      "darknessScore": 73,
      "dewScore": 68,
      "elevationScore": 55,
      "temperatureComfortScore": 97,
      "windComfortScore": 100,
      "rainComfortScore": 73,
      "accessScore": 72,
      "confidenceScore": 100,
      "confidenceLevel": "high",
      "reasons": [
        "Clear-sky climatology score: 80",
        "Calibrated darkness score: 73"
      ],
      "caveats": [
        "Temperature comfort uses the monthly astronomical-night mean, not hourly utility"
      ]
    },
    {
      "siteId": "hoshizora-park-bisei",
      "month": 12,
      "skyQuality": 73,
      "tripComfort": 83,
      "stargazingTrip": 75,
      "clearSkyScore": 74,
      "darknessScore": 73,
      "dewScore": 76,
      "elevationScore": 55,
      "temperatureComfortScore": 77,
      "windComfortScore": 99,
      "rainComfortScore": 77,
      "accessScore": 72,
      "confidenceScore": 100,
      "confidenceLevel": "high",
      "reasons": [
        "Clear-sky climatology score: 74",
        "Calibrated darkness score: 73"
      ],
      "caveats": [
        "Temperature comfort uses the monthly astronomical-night mean, not hourly utility"
      ]
    }
  ]
}
